{
  "version": 1,
  "meta": {
    "title": "Three-tier web application"
  },
  "canvas": {},
  "groups": [
    {
      "id": "edge-tier",
      "kind": "group",
      "label": "Edge",
      "rect": [0, 0, 8, 16],
      "color": "#2563eb",
      "labelSize": 44
    },
    {
      "id": "prod-vpc",
      "kind": "vpc",
      "label": "Production",
      "rect": [10, 0, 29, 16],
      "color": "#eab308",
      "labelSize": 96
    },
    {
      "id": "public-subnet",
      "kind": "subnet",
      "label": "Public",
      "rect": [11, 1, 8, 14],
      "color": "#e7157b",
      "labelPlane": "left",
      "labelSize": 44,
      "parent": "prod-vpc"
    },
    {
      "id": "private-subnet",
      "kind": "subnet",
      "label": "Private",
      "rect": [21, 1, 17, 14],
      "color": "#a855f7",
      "labelPlane": "left",
      "labelSize": 44,
      "parent": "prod-vpc"
    }
  ],
  "nodes": [
    {
      "id": "visitors",
      "type": "user",
      "label": "Visitors",
      "pos": [3, 3],
      "size": [2, 2],
      "height": 1,
      "color": "#5a6b7b",
      "labelPlane": "right",
      "labelSize": 40,
      "group": "edge-tier"
    },
    {
      "id": "cdn",
      "type": "cloudfront",
      "label": "CloudFront",
      "pos": [3, 8],
      "size": [2, 2],
      "height": 1,
      "color": "#1f8f8f",
      "labelPlane": "right",
      "labelSize": 40,
      "group": "edge-tier"
    },
    {
      "id": "assets",
      "type": "s3",
      "label": "Assets",
      "pos": [3, 12],
      "size": [2, 2],
      "height": 1,
      "color": "#b4530f",
      "labelPlane": "right",
      "labelSize": 40,
      "group": "edge-tier"
    },
    {
      "id": "igw",
      "type": "igw",
      "label": "Gateway",
      "pos": [14, 3],
      "size": [2, 2],
      "height": 1,
      "color": "#1f8f8f",
      "labelPlane": "right",
      "labelSize": 40,
      "group": "public-subnet"
    },
    {
      "id": "alb",
      "type": "elb",
      "label": "ALB",
      "pos": [14, 8],
      "size": [2, 2],
      "height": 1,
      "color": "#1f8f8f",
      "labelPlane": "right",
      "labelSize": 40,
      "group": "public-subnet"
    },
    {
      "id": "nat",
      "type": "natgw",
      "label": "NAT",
      "pos": [14, 12],
      "size": [2, 2],
      "height": 1,
      "color": "#1f8f8f",
      "labelPlane": "right",
      "labelSize": 40,
      "group": "public-subnet"
    },
    {
      "id": "web-2",
      "type": "ec2",
      "label": "Web 2",
      "pos": [24, 3],
      "size": [2, 2],
      "height": 1,
      "color": "#12a37a",
      "labelPlane": "right",
      "labelSize": 40,
      "group": "private-subnet"
    },
    {
      "id": "web-1",
      "type": "ec2",
      "label": "Web 1",
      "pos": [24, 8],
      "size": [2, 2],
      "height": 1,
      "color": "#12a37a",
      "labelPlane": "right",
      "labelSize": 40,
      "group": "private-subnet"
    },
    {
      "id": "worker",
      "type": "ecs",
      "label": "Worker",
      "pos": [24, 12],
      "size": [2, 2],
      "height": 1,
      "color": "#12a37a",
      "labelPlane": "right",
      "labelSize": 40,
      "group": "private-subnet"
    },
    {
      "id": "jobs",
      "type": "sqs",
      "label": "Queue",
      "pos": [30, 12],
      "size": [2, 2],
      "height": 1,
      "color": "#2c7de0",
      "labelPlane": "right",
      "labelSize": 40,
      "group": "private-subnet"
    },
    {
      "id": "cache",
      "type": "elasticache",
      "label": "Redis",
      "pos": [35, 3],
      "size": [2, 2],
      "height": 1,
      "color": "#b4530f",
      "labelPlane": "right",
      "labelSize": 40,
      "group": "private-subnet"
    },
    {
      "id": "db",
      "type": "rds",
      "label": "Postgres",
      "pos": [35, 8],
      "size": [2, 2],
      "height": 1,
      "color": "#b4530f",
      "labelPlane": "right",
      "labelSize": 40,
      "group": "private-subnet"
    },
    {
      "id": "backups",
      "type": "s3",
      "label": "Backups",
      "pos": [35, 12],
      "size": [2, 2],
      "height": 1,
      "color": "#b4530f",
      "labelPlane": "right",
      "labelSize": 40,
      "group": "private-subnet"
    }
  ],
  "edges": [
    {
      "id": "e-https",
      "from": "cdn",
      "to": "alb",
      "label": "HTTPS",
      "style": "solid",
      "arrow": "end",
      "color": "#1f8f8f",
      "labelSize": 30
    },
    {
      "id": "e-web",
      "from": "alb",
      "to": "web-1",
      "style": "solid",
      "arrow": "end",
      "color": "#12a37a"
    },
    {
      "id": "e-enqueue",
      "from": "web-1",
      "to": "jobs",
      "style": "solid",
      "arrow": "end",
      "route": "x",
      "color": "#2c7de0"
    },
    {
      "id": "e-work",
      "from": "jobs",
      "to": "worker",
      "style": "solid",
      "arrow": "end",
      "color": "#2c7de0"
    },
    {
      "id": "e-outbound",
      "from": "worker",
      "to": "nat",
      "style": "dashed",
      "arrow": "end",
      "color": "#1f8f8f"
    }
  ],
  "texts": [
    {
      "id": "note-edge",
      "text": "Static assets never\nreach the VPC.",
      "pos": [1, 19],
      "size": 50,
      "color": "#64748b",
      "italic": true
    },
    {
      "id": "note-private",
      "text": "No route in from\nthe internet.",
      "pos": [24, 19],
      "size": 50,
      "color": "#64748b",
      "italic": true
    }
  ],
  "images": []
}
